{
  "schema_version": "1.0",
  "policy_key": "CURVE_CORE_POLICY",
  "policy_version": 1,
  "default_effect": "DENY",
  "unknown_classification": "RESTRICTED",
  "deny_precedence": [
    "POLICY_CONTEXT_INVALID",
    "FEATURE_DISABLED",
    "UNAUTHENTICATED",
    "AGENT_NOT_ALLOWED",
    "WORKSPACE_MISMATCH",
    "INACTIVE_MEMBERSHIP",
    "UNKNOWN_ACTION",
    "RESOURCE_TYPE_NOT_ALLOWED",
    "RESOURCE_NOT_FOUND",
    "UNSUPPORTED_PRINCIPAL",
    "ROLE_NOT_ALLOWED",
    "ENVIRONMENT_NOT_ALLOWED",
    "CLASSIFICATION_NOT_ALLOWED",
    "OBJECT_ACL_REQUIRED",
    "OBJECT_ACL_DENIED",
    "ASSIGNMENT_REQUIRED",
    "ASSIGNMENT_MISMATCH",
    "SEPARATION_OF_DUTY_DENIED",
    "TARGET_ALLOWLIST_REQUIRED",
    "TARGET_NOT_ALLOWED",
    "SERVICE_AUTHORIZATION_REQUIRED",
    "SERVICE_AUTHORIZATION_INVALID",
    "SERVICE_AUTHORIZATION_INACTIVE",
    "SERVICE_AUTHORIZATION_EXPIRED",
    "EXTERNAL_EFFECT_NOT_ALLOWED"
  ],
  "actions": [
    {
      "action": "CURVE.SHELL.VIEW",
      "allowed_resource_types": ["WORKSPACE"],
      "allowed_actor_types": ["HUMAN"],
      "allowed_roles": [
        "WORKSPACE_MEMBER",
        "PRODUCT_APPROVER",
        "TECHNICAL_APPROVER",
        "CODE_APPROVER",
        "PLATFORM_ADMINISTRATOR"
      ],
      "allowed_classifications": ["INTERNAL"],
      "allowed_environments": ["LOCAL", "STAGING", "PRODUCTION"],
      "object_acl": "NOT_APPLICABLE",
      "assignment": "NONE",
      "separation_of_duty": "NONE",
      "target_allowlist": "NOT_APPLICABLE",
      "external_side_effect": false,
      "permitted_projection": ["WORKSPACE_ID", "WORKSPACE_SLUG", "SHELL_STATE"]
    },
    {
      "action": "CURVE.OPERATION.READ",
      "allowed_resource_types": ["OPERATION"],
      "allowed_actor_types": ["HUMAN", "SERVICE"],
      "allowed_roles": [
        "WORKSPACE_MEMBER",
        "PRODUCT_APPROVER",
        "TECHNICAL_APPROVER",
        "CODE_APPROVER",
        "PLATFORM_ADMINISTRATOR",
        "TRUSTED_SERVICE"
      ],
      "allowed_classifications": ["INTERNAL", "CONFIDENTIAL", "RESTRICTED"],
      "allowed_environments": ["LOCAL", "STAGING", "PRODUCTION"],
      "object_acl": "REQUIRED",
      "assignment": "NONE",
      "separation_of_duty": "NONE",
      "target_allowlist": "NOT_APPLICABLE",
      "external_side_effect": false,
      "permitted_projection": ["OPERATION_SAFE_METADATA"]
    },
    {
      "action": "CURVE.OPERATION.CANCEL",
      "allowed_resource_types": ["OPERATION"],
      "allowed_actor_types": ["HUMAN", "SERVICE"],
      "allowed_roles": [
        "WORKSPACE_MEMBER",
        "PRODUCT_APPROVER",
        "TECHNICAL_APPROVER",
        "CODE_APPROVER",
        "PLATFORM_ADMINISTRATOR",
        "TRUSTED_SERVICE"
      ],
      "allowed_classifications": ["INTERNAL", "CONFIDENTIAL", "RESTRICTED"],
      "allowed_environments": ["LOCAL", "STAGING", "PRODUCTION"],
      "object_acl": "REQUIRED",
      "assignment": "NONE",
      "separation_of_duty": "NONE",
      "target_allowlist": "NOT_APPLICABLE",
      "external_side_effect": false,
      "permitted_projection": ["NO_BODY"]
    },
    {
      "action": "CURVE.FOUNDATION_PROBE.START",
      "allowed_resource_types": ["WORKSPACE"],
      "allowed_actor_types": ["HUMAN"],
      "allowed_roles": [
        "WORKSPACE_MEMBER",
        "PRODUCT_APPROVER",
        "TECHNICAL_APPROVER",
        "CODE_APPROVER",
        "PLATFORM_ADMINISTRATOR"
      ],
      "allowed_classifications": ["INTERNAL"],
      "allowed_environments": ["LOCAL"],
      "object_acl": "NOT_APPLICABLE",
      "assignment": "NONE",
      "separation_of_duty": "NONE",
      "target_allowlist": "NOT_APPLICABLE",
      "external_side_effect": false,
      "permitted_projection": ["OPERATION_SAFE_METADATA"]
    },
    {
      "action": "CURVE.PROVIDER_CONNECTION.ADMINISTER",
      "allowed_resource_types": ["PROVIDER_CONNECTION"],
      "allowed_actor_types": ["HUMAN"],
      "allowed_roles": ["PLATFORM_ADMINISTRATOR"],
      "allowed_classifications": ["INTERNAL", "CONFIDENTIAL", "RESTRICTED"],
      "allowed_environments": ["LOCAL", "STAGING", "PRODUCTION"],
      "object_acl": "OPTIONAL_NARROWING",
      "assignment": "NONE",
      "separation_of_duty": "NONE",
      "target_allowlist": "REQUIRED",
      "external_side_effect": false,
      "permitted_projection": ["NO_BODY"]
    },
    {
      "action": "CURVE.GATE.DECIDE.PRD",
      "allowed_resource_types": ["ARTIFACT_VERSION"],
      "allowed_actor_types": ["HUMAN"],
      "allowed_roles": ["PRODUCT_APPROVER"],
      "allowed_classifications": ["INTERNAL", "CONFIDENTIAL", "RESTRICTED"],
      "allowed_environments": ["LOCAL", "STAGING", "PRODUCTION"],
      "object_acl": "REQUIRED",
      "assignment": "PRODUCT_APPROVER",
      "separation_of_duty": "GATE_RISK_TIER",
      "target_allowlist": "NOT_APPLICABLE",
      "external_side_effect": false,
      "permitted_projection": ["NO_BODY"]
    },
    {
      "action": "CURVE.GATE.DECIDE.PLAN",
      "allowed_resource_types": ["EXECUTION_PLAN"],
      "allowed_actor_types": ["HUMAN"],
      "allowed_roles": ["TECHNICAL_APPROVER"],
      "allowed_classifications": ["INTERNAL", "CONFIDENTIAL", "RESTRICTED"],
      "allowed_environments": ["LOCAL", "STAGING", "PRODUCTION"],
      "object_acl": "REQUIRED",
      "assignment": "TECHNICAL_APPROVER",
      "separation_of_duty": "GATE_RISK_TIER",
      "target_allowlist": "NOT_APPLICABLE",
      "external_side_effect": false,
      "permitted_projection": ["NO_BODY"]
    },
    {
      "action": "CURVE.GATE.DECIDE.CODE_READINESS",
      "allowed_resource_types": ["PULL_REQUEST_SET"],
      "allowed_actor_types": ["HUMAN"],
      "allowed_roles": ["CODE_APPROVER"],
      "allowed_classifications": ["INTERNAL", "CONFIDENTIAL", "RESTRICTED"],
      "allowed_environments": ["LOCAL", "STAGING", "PRODUCTION"],
      "object_acl": "REQUIRED",
      "assignment": "CODE_APPROVER",
      "separation_of_duty": "GATE_RISK_TIER",
      "target_allowlist": "NOT_APPLICABLE",
      "external_side_effect": false,
      "permitted_projection": ["NO_BODY"]
    },
    {
      "action": "CURVE.FINDING.DISPOSITION.NON_SECURITY",
      "allowed_resource_types": ["REVIEW_FINDING"],
      "allowed_actor_types": ["HUMAN"],
      "allowed_roles": ["TECHNICAL_APPROVER"],
      "allowed_classifications": ["INTERNAL", "CONFIDENTIAL", "RESTRICTED"],
      "allowed_environments": ["LOCAL", "STAGING", "PRODUCTION"],
      "object_acl": "REQUIRED",
      "assignment": "TECHNICAL_APPROVER",
      "separation_of_duty": "NONE",
      "target_allowlist": "NOT_APPLICABLE",
      "external_side_effect": false,
      "permitted_projection": ["NO_BODY"]
    }
  ]
}
